{
  "id": "req-demo-social-media",
  "title": "LinkedIn-Beitrag",
  "summary": "FIKTIVE Anfrage zur Illustration; keine reale Freigabe oder Außenwirkung.",
  "requested_by": "social-media-Spezialist",
  "requested_at": "2026-10-27T09:00:00+01:00",
  "artifact": {
    "id": "art-demo-social-media",
    "owner_module": "social-media",
    "path": ".suite/beispiele/approval-demo/linkedin-v3.txt",
    "version": 3,
    "status": "review",
    "sha256": "fb357f4ea809bbf8025827599e10d94e70f7eb96731f12594091c6b8bd7d2d28",
    "contains_personal_data": false,
    "rights_status": "cleared",
    "notes": "FIKTIVER Testinhalt, kein Produktionsartefakt."
  },
  "action": "publish",
  "target": "linkedin:fictional-account",
  "reviews": [
    {
      "id": "rv-demo-social-media-expert",
      "artifact_id": "art-demo-social-media",
      "artifact_version": 3,
      "dimension": "expert",
      "status": "pass",
      "reviewed_at": "2026-10-27T08:50:00+01:00",
      "reviewer": "Fiktive Prüfperson",
      "findings": [],
      "evidence_refs": [
        "fixture:linkedin-v3.txt:expert"
      ]
    },
    {
      "id": "rv-demo-social-media-legal",
      "artifact_id": "art-demo-social-media",
      "artifact_version": 3,
      "dimension": "legal",
      "status": "pass",
      "reviewed_at": "2026-10-27T08:50:00+01:00",
      "reviewer": "Fiktive Prüfperson",
      "findings": [],
      "evidence_refs": [
        "fixture:linkedin-v3.txt:legal"
      ]
    }
  ]
}
