{
  "id": "req-demo-website",
  "title": "Website-Startseite",
  "summary": "FIKTIVE Anfrage zur Illustration; keine reale Freigabe oder Außenwirkung.",
  "requested_by": "website-Spezialist",
  "requested_at": "2026-10-27T09:00:00+01:00",
  "artifact": {
    "id": "art-demo-website",
    "owner_module": "website",
    "path": ".suite/beispiele/approval-demo/website-v2.html",
    "version": 2,
    "status": "review",
    "sha256": "892a19f54a4f6411f4287ce2d007ed0c90a5800042a204571b4d65aea72f5fc1",
    "contains_personal_data": false,
    "rights_status": "cleared",
    "notes": "FIKTIVER Testinhalt, kein Produktionsartefakt."
  },
  "action": "publish",
  "target": "website:fictional-production",
  "reviews": [
    {
      "id": "rv-demo-website-expert",
      "artifact_id": "art-demo-website",
      "artifact_version": 2,
      "dimension": "expert",
      "status": "pass",
      "reviewed_at": "2026-10-27T08:50:00+01:00",
      "reviewer": "Fiktive Prüfperson",
      "findings": [],
      "evidence_refs": [
        "fixture:website-v2.html:expert"
      ]
    },
    {
      "id": "rv-demo-website-legal",
      "artifact_id": "art-demo-website",
      "artifact_version": 2,
      "dimension": "legal",
      "status": "pass",
      "reviewed_at": "2026-10-27T08:50:00+01:00",
      "reviewer": "Fiktive Prüfperson",
      "findings": [],
      "evidence_refs": [
        "fixture:website-v2.html:legal"
      ]
    }
  ]
}
